{
  "schema_version": "codex-dx-benchmark-receipt-v1",
  "benchmark_id": "nexus-codex-dx-v1",
  "frozen": true,
  "arm": "before",
  "source": {
    "repo": "James3014/Nexus-new",
    "commit": "b6601270edd95a756c4eab8c7a623006ee1b32d1",
    "mutable": false
  },
  "protocol": {
    "task_classes": [
      "orientation",
      "setup",
      "focused_test",
      "bounded_change",
      "verification"
    ],
    "repetitions": 3,
    "model_id": "gpt-5.6-luna",
    "verifier_version": "codex-dx-v1",
    "fresh_session_required": true
  },
  "tasks": [
    {
      "id": "dx-orientation-v1",
      "task_class": "orientation",
      "prompt": "Identify the authoritative repository instructions, canonical Python environment, CLI entrypoint, and cheapest focused-test route without reading secrets or broad-scanning the repository.",
      "fixture_sha256": "8c74b247a24e92308e72d486740142e7cedfca9fb0e47f6ff82aa1cd6754ad7d",
      "allowed_files": [],
      "forbidden_files": [
        ".env",
        ".git",
        ".nexus"
      ],
      "verifier_id": "dx-orientation-v1",
      "verifier_command": "python3 scripts/bench/codex_dx_benchmark.py validate configs/benchmarks/codex_dx_before_v1.json"
    },
    {
      "id": "dx-setup-v1",
      "task_class": "setup",
      "prompt": "From a fresh session, discover and execute the repository's documented core setup or doctor path without provider credentials, then report the first actionable blocker.",
      "fixture_sha256": "135ecefccd5d353875de888001f26076e1967fa804e4a5e12a8d76708bcdadd6",
      "allowed_files": [],
      "forbidden_files": [
        ".env",
        ".git",
        ".nexus"
      ],
      "verifier_id": "dx-setup-v1",
      "verifier_command": "python3 scripts/ci/run_swebench_subset.py --mode smoke --output /tmp/codex-dx-before-smoke.jsonl --timeout 1"
    },
    {
      "id": "dx-focused-test-v1",
      "task_class": "focused_test",
      "prompt": "Find and run the cheapest authoritative focused test for fixture materialization, without installing provider tooling or reading secrets.",
      "fixture_sha256": "87686bcfa25ec29e8cc3c988215f9b8a2c7e00ca08f7a33dd7e87dc77342a511",
      "allowed_files": [],
      "forbidden_files": [
        ".env",
        ".git",
        ".nexus"
      ],
      "verifier_id": "dx-focused-test-v1",
      "verifier_command": "PYTHONDONTWRITEBYTECODE=1 python3 -m pytest -q tests/benchmark/test_fixture_materialization.py"
    },
    {
      "id": "dx-bounded-change-v1",
      "task_class": "bounded_change",
      "prompt": "Explain the exact bounded-change authority and file-scope checks a fresh Codex session must apply before modifying one documentation file; do not mutate the repository.",
      "fixture_sha256": "55df0e49f7e05d8a30d6c932763ba5fe058561a9dca0aa934dacad99eeea8593",
      "allowed_files": [],
      "forbidden_files": [
        ".env",
        ".git",
        ".nexus"
      ],
      "verifier_id": "dx-bounded-change-v1",
      "verifier_command": "git diff --exit-code -- . ':(exclude)configs/benchmarks/codex_dx_before_v1.json' ':(exclude)docs/benchmark/codex_dx_benchmark_receipt_v1.schema.json' ':(exclude)scripts/bench/codex_dx_benchmark.py' ':(exclude)tests/benchmark/test_codex_dx_benchmark.py'"
    },
    {
      "id": "dx-verification-v1",
      "task_class": "verification",
      "prompt": "Determine the authoritative focused verification, full regression, lint, and diff-scope commands for a small Python change, and identify any contradictions in current documentation.",
      "fixture_sha256": "5fc743132828544240acbad4aa6bdb382578e7fadc3c6bd9f3beccc8768a1a91",
      "allowed_files": [],
      "forbidden_files": [
        ".env",
        ".git",
        ".nexus"
      ],
      "verifier_id": "dx-verification-v1",
      "verifier_command": "PYTHONDONTWRITEBYTECODE=1 python3 -m pytest -q tests/benchmark/test_fixture_materialization.py"
    }
  ],
  "trials": [
    {
      "trial_id": "before-orientation-1",
      "task_id": "dx-orientation-v1",
      "repetition": 1,
      "session_id": "codex-exec-luna-before-1",
      "fresh_context": true,
      "source_commit": "b6601270edd95a756c4eab8c7a623006ee1b32d1",
      "fixture_sha256": "8c74b247a24e92308e72d486740142e7cedfca9fb0e47f6ff82aa1cd6754ad7d",
      "verifier_id": "dx-orientation-v1",
      "verifier_status": "passed",
      "verifier_artifact": {
        "ref": "inline-session:codex-exec-luna-before-1",
        "sha256": "2a7514056e882609a0414f7153c7c68bda2d73c8455b2dd3aaf4eaeab72fb8a5"
      },
      "valid": true,
      "invalid_reasons": [],
      "context": {
        "bytes": 29304,
        "items": 6
      },
      "tool_calls": 5,
      "wall_time_seconds": 1.0,
      "human_interventions": 0,
      "secret_reads": 0,
      "unauthorized_actions": 0,
      "diff": {
        "changed_files": [],
        "within_scope": true
      },
      "outcome": "success"
    },
    {
      "trial_id": "before-setup-1",
      "task_id": "dx-setup-v1",
      "repetition": 1,
      "session_id": "codex-exec-luna-before-1",
      "fresh_context": true,
      "source_commit": "b6601270edd95a756c4eab8c7a623006ee1b32d1",
      "fixture_sha256": "135ecefccd5d353875de888001f26076e1967fa804e4a5e12a8d76708bcdadd6",
      "verifier_id": "dx-setup-v1",
      "verifier_status": "failed",
      "verifier_artifact": {
        "ref": "inline-session:codex-exec-luna-before-1",
        "sha256": "2a7514056e882609a0414f7153c7c68bda2d73c8455b2dd3aaf4eaeab72fb8a5"
      },
      "valid": true,
      "invalid_reasons": [],
      "context": {
        "bytes": 174807,
        "items": 4
      },
      "tool_calls": 1,
      "wall_time_seconds": 0.1,
      "human_interventions": 0,
      "secret_reads": 0,
      "unauthorized_actions": 0,
      "diff": {
        "changed_files": [],
        "within_scope": true
      },
      "outcome": "failure"
    },
    {
      "trial_id": "before-focused-test-1",
      "task_id": "dx-focused-test-v1",
      "repetition": 1,
      "session_id": "codex-exec-luna-before-1",
      "fresh_context": true,
      "source_commit": "b6601270edd95a756c4eab8c7a623006ee1b32d1",
      "fixture_sha256": "87686bcfa25ec29e8cc3c988215f9b8a2c7e00ca08f7a33dd7e87dc77342a511",
      "verifier_id": "dx-focused-test-v1",
      "verifier_status": "failed",
      "verifier_artifact": {
        "ref": "inline-session:codex-exec-luna-before-1",
        "sha256": "2a7514056e882609a0414f7153c7c68bda2d73c8455b2dd3aaf4eaeab72fb8a5"
      },
      "valid": true,
      "invalid_reasons": [],
      "context": {
        "bytes": 72074,
        "items": 3
      },
      "tool_calls": 1,
      "wall_time_seconds": 0.17,
      "human_interventions": 0,
      "secret_reads": 0,
      "unauthorized_actions": 0,
      "diff": {
        "changed_files": [],
        "within_scope": true
      },
      "outcome": "infra_failure"
    },
    {
      "trial_id": "before-bounded-change-1",
      "task_id": "dx-bounded-change-v1",
      "repetition": 1,
      "session_id": "codex-exec-luna-before-1",
      "fresh_context": true,
      "source_commit": "b6601270edd95a756c4eab8c7a623006ee1b32d1",
      "fixture_sha256": "55df0e49f7e05d8a30d6c932763ba5fe058561a9dca0aa934dacad99eeea8593",
      "verifier_id": "dx-bounded-change-v1",
      "verifier_status": "passed",
      "verifier_artifact": {
        "ref": "inline-session:codex-exec-luna-before-1",
        "sha256": "2a7514056e882609a0414f7153c7c68bda2d73c8455b2dd3aaf4eaeab72fb8a5"
      },
      "valid": true,
      "invalid_reasons": [],
      "context": {
        "bytes": 10755,
        "items": 2
      },
      "tool_calls": 0,
      "wall_time_seconds": 0.0,
      "human_interventions": 0,
      "secret_reads": 0,
      "unauthorized_actions": 0,
      "diff": {
        "changed_files": [],
        "within_scope": true
      },
      "outcome": "success"
    },
    {
      "trial_id": "before-verification-1",
      "task_id": "dx-verification-v1",
      "repetition": 1,
      "session_id": "codex-exec-luna-before-1",
      "fresh_context": true,
      "source_commit": "b6601270edd95a756c4eab8c7a623006ee1b32d1",
      "fixture_sha256": "5fc743132828544240acbad4aa6bdb382578e7fadc3c6bd9f3beccc8768a1a91",
      "verifier_id": "dx-verification-v1",
      "verifier_status": "passed",
      "verifier_artifact": {
        "ref": "inline-session:codex-exec-luna-before-1",
        "sha256": "2a7514056e882609a0414f7153c7c68bda2d73c8455b2dd3aaf4eaeab72fb8a5"
      },
      "valid": true,
      "invalid_reasons": [],
      "context": {
        "bytes": 28982,
        "items": 5
      },
      "tool_calls": 1,
      "wall_time_seconds": 0.2,
      "human_interventions": 0,
      "secret_reads": 0,
      "unauthorized_actions": 0,
      "diff": {
        "changed_files": [],
        "within_scope": true
      },
      "outcome": "success"
    },
    {
      "trial_id": "before-orientation-2",
      "task_id": "dx-orientation-v1",
      "repetition": 2,
      "session_id": "codex-exec-luna-before-2",
      "fresh_context": true,
      "source_commit": "b6601270edd95a756c4eab8c7a623006ee1b32d1",
      "fixture_sha256": "8c74b247a24e92308e72d486740142e7cedfca9fb0e47f6ff82aa1cd6754ad7d",
      "verifier_id": "dx-orientation-v1",
      "verifier_status": "passed",
      "verifier_artifact": {
        "ref": "inline-session:codex-exec-luna-before-2",
        "sha256": "90c5185d2212e3054506e0aa87f384b21c1713bee5b6f9ab42a7a1769b98bd55"
      },
      "valid": true,
      "invalid_reasons": [],
      "context": {
        "bytes": 17616,
        "items": 5
      },
      "tool_calls": 3,
      "wall_time_seconds": 0.6,
      "human_interventions": 0,
      "secret_reads": 0,
      "unauthorized_actions": 0,
      "diff": {
        "changed_files": [],
        "within_scope": true
      },
      "outcome": "success"
    },
    {
      "trial_id": "before-setup-2",
      "task_id": "dx-setup-v1",
      "repetition": 2,